{
  "id": "fixture-short-text",
  "platform": "x",
  "authorName": "Maya Laurent",
  "authorHandle": "@maya_laurent",
  "content": "The best product moments are quiet: the user brings the context, and the tool makes it travel cleanly.",
  "publishedAt": "2026-06-10T08:15:00.000Z",
  "sourceUrl": "https://x.com/maya_laurent/status/1001",
  "media": [],
  "capturedAt": "2026-06-15T10:00:00.000Z"
}
